{
  "$schema": "https://agent-project-os.org/schemas/portfolio-manifest-v1.schema.json",
  "name": "Synthetic Commerce Workspace",
  "portfolio_id": "synthetic-commerce",
  "projects": [
    {
      "consumes": [],
      "depends_on": [],
      "lifecycle": "active",
      "owner": "human:example",
      "path": "projects/contracts",
      "project_id": "contracts",
      "provides": ["orders@2"],
      "repository": "https://example.invalid/contracts.git",
      "verification": ["python -m unittest"]
    },
    {
      "consumes": ["orders@2"],
      "depends_on": ["contracts"],
      "lifecycle": "active",
      "owner": "human:example",
      "path": "projects/service",
      "project_id": "service",
      "provides": ["service-api@2"],
      "repository": "https://example.invalid/service.git",
      "verification": ["node --test"]
    },
    {
      "consumes": ["service-api@2"],
      "depends_on": ["service"],
      "lifecycle": "active",
      "owner": "human:example",
      "path": "projects/client",
      "project_id": "client",
      "provides": [],
      "repository": "https://example.invalid/client.git",
      "verification": ["cargo test"]
    }
  ],
  "protocol_version": "1.0"
}
